,DatGeracaoConjuntoDados,NomAgente,IdeEmpresaProponenteProjeto,DscCodProjeto,DscTituloProjeto,DscTipologia,VlrCustoTotal,VlrRcbGlobal,VlrEnergiaEconomizadaTotal,VlrRetiradaDemandaPontaTotal,DscObjetivo,DscJustificativa,DatInicioProjeto,DatConclusaoProjeto,DscMetodologiaMv,Score,Address,Latitude,Longitude,Estado,Capital
50,2024-04-01,COPEL DISTRIBUIÇÃO SA,8155,PE-02866-0181/2017,PEE CP 001/2016 Bom Jesus,Comércio e Serviços,0.0,0.57,664.86,159.35,"O projeto teve como objetivo a eficientização energética nos sistemas de iluminação da Associação Franciscana de Ensino Senhor Bom Jesus e instalação de Fonte geradora solar fotovoltaica. Com isto, poderemos promover o uso racional e eficiente de energia elétrica naquela unidade consumidora.","Obteremos redução da demanda no horário de ponta (kW) e economia de energia (MWh/ano) em função da redução de consumo (kW/h). Isto possibilitará a COPEL atender novos consumidores sem investimentos adicionais, otimizando o uso do sistema elétrico, preservando o meio ambiente e contribuindo para a sustentabilidade.",2017-09-11,2021-06-01,"Iluminação:  A avaliação será pela  opção A do PIMVP onde estão previstas o monitoramento de pelo menos uma das  variáveis de influência do consumo (potencia ativa) , sendo que o tempo de utilização poderá ser estimado conforme permite o protocolo.Fonte incentivada: O consumo energético bem como as demais variáveis serão monitoradas pelo período de 12 meses.",1.0559731150961031,"Copel Distribuição S.A., Rua Vicente Machado, Guarapuava, Região Geográfica Imediata de Guarapuava, Região Geográfica Intermediária de Guarapuava, Paraná, Região Sul, 85010-050, Brasil",-25.38696195,-51.474271,Paraná,Guarapuava
51,2024-04-01,ELEKTRO REDES SA,4875,PE-00385-0057/2017,Eficincia Energtica em clientes residenciais,Residencial,0.0,0.48,814.44,7.19,"Incentivar o uso da energia eltrica em residencias de forma eficiente, com gerao de energia atravs de energia solar fotovoltaica e com a utilizao de equipamentos mais eficientes, como lmpadas LED.","Opo A:Energia: Ser obtida pela multiplicao da potencia medida pelo tempo de funcionamento estimado- Potncia: Ser medido por sensor de corrente, sendo analisada pelo analisador de energia, sendo, portanto, parametro chave- tempo de funcionamento: ser estimado. Fator de coincidencia na ponta tambm ser estimado. Opo B: medio isolada de todos os parmetros no sendo considerado FCP.",2017-11-01,2020-07-31,"Opção A do PIMV, para iluminação- Opção B do PIMV para sistema fotovoltaico.",1.0557248460828346,"Tecnologia Avanzada en Redes. S.A, Carretera a San José Pinula, Condominio Cañadas del Pajon 2, Fraijanes, Santa Catarina Pinula, Departamento de Guatemala, 01052, Guatemala",14.5442807,-90.44272761967392,Departamento de Guatemala,
52,2024-04-01,CENTRAIS ELETRICAS DO PARA,8964,PE-00371-0027/2019,PROJETO DE EFICIENTIZACAO DA ILUMINACAO PUBLICA DO MUNICIPIO DE DOM ELISEU,Iluminação Pública,0.0,0.17,654.59,156.22,"Implantação de ações de eficiência energética (AEE) no sistema de iluminação pública no município de DOM ELISEU, através substituição de luminárias, lâmpadas, reatores, relés fotoelétricos, braços e demais dispositivos de fixação por conjuntos de iluminação com melhor eficiência energética e luminosa, baseados na tecnologia LED.",nao se aplica,2019-10-18,2022-12-21,Sera utilizada a opcao A do PIMV para o sistema de Iluminacao,1.054683655879902,"Centrais Elétricas do Pará, Alameda NS 10, Conjunto Jardim Maguari, Coqueiro, Belém, Região Geográfica Imediata de Belém, Região Geográfica Intermediária de Belém, Pará, Região Norte, 66823-077, Brasil",-1.3363303,-48.44656919031406,Pará,Belém
53,2024-04-01,COMPANHIA DE ELETRICIDADE DO ESTADO DA BAHIA,1422,PE-00047-0079/1999,Expansão do projeto de Controlador de Demanda Residencial na Região de Vitória da Conquista,Pelo Lado da Oferta/Fator de Carga,0.0,0.41,0.0,800.0,,,1998-01-01,1999-12-31,,1.0536434279599665,"Companhia de Eletricidade do Estado da Bahia, Avenida Doutor Guilherme Dias, Ginásio Industrial, Brumado, Região Geográfica Intermediária de Vitória da Conquista, Bahia, Região Nordeste, 46100-970, Brasil",-14.207599649999999,-41.669760408092785,Bahia,
54,2024-04-01,COMPANHIA PAULISTA DE FORÇA E LUZ,8879,PE-00063-0193/2019,EE_00063_0193_2019_BONUS FV DINAMICA_CPP19,Residencial,0.0,0.31,758.21,1.0,"Reduzir o desperdício de energia elétrica no poder público, por meio de implementação de projeto de eficiência energética.",Cumprir metas regulatórias,2019-11-11,2022-06-30,A-Medição Parcial de Retrofit isolado,1.04971827561453,"Companhia Paulista de Força e Luz, Avenida Sete de Setembro, Vila Pavani, Nova Granada, Região Imediata de São José do Rio Preto, Região Metropolitana de São José do Rio Preto, Região Geográfica Intermediária de São José do Rio Preto, São Paulo, Região Sudeste, 15440-000, Brasil",-20.5356207,-49.3242102,São Paulo,
55,2024-04-01,COMPANHIA PAULISTA DE FORÇA E LUZ,8484,PE-00063-0191/2019,EE_00063_00191_UFSCAR ÁREA SUL CPP19,Poder Público,0.0,0.64,598.98,155.7,"Substituir o sistema de iluminação existente, composto por 5.658 lâmpadas fluorescentes tubulares e vapor de sódio  por sistema utilizando 5.658 lâmpadas com tecnologia LED, substituir 3 ar condicionado Splits, com capacidades de 20 TR, por outros 2 com capacidades de 20 TR e 1 com capacidade de 15 TR e  Instalação de 59,9 kWp de geração fotovoltaica.","Cumprir regras regulatórias da ANEEL, realizando projetos de eficiência energética aprovados através da Chamada Pública de Projetos de 2019.",2019-12-18,2022-01-31,Opção A - pois a determinação das economias será feita a curto prazo para ser viável economicamente. A extrapolação dos resultados para o longo prazo será feita por meio de estudos específicos.,1.049282361416814,"Companhia Paulista de Força e Luz, Avenida Sete de Setembro, Vila Pavani, Nova Granada, Região Imediata de São José do Rio Preto, Região Metropolitana de São José do Rio Preto, Região Geográfica Intermediária de São José do Rio Preto, São Paulo, Região Sudeste, 15440-000, Brasil",-20.5356207,-49.3242102,São Paulo,
56,2024-04-01,COPEL DISTRIBUIÇÃO SA,9320,PE-02866-0205/2018,PEE_CP_003_2017 Centrais de Abastecimento do Paraná,Comércio e Serviços,0.0,0.31,643.06,90.65,"O projeto tem como objetivo a eficientização energética nos sistemas de iluminação da Centrais de Abastecimento do e instalação de Fonte geradora solar fotovoltaica. Com isto, poderemos promover o uso racional e eficiente de energia","Obteremos redução da demanda no horário de ponta (kW) e economia de energia (MWh/ano) em função da redução de consumo (kW/h). Isto possibilitará a COPEL atender novos consumidores sem investimentos adicionais, otimizando o uso do sistema elétrico, preservando o meio ambiente e contribuindo para a sustentabilidade.",2018-09-01,2022-09-13,"Iluminação: Mensuração da potencia ativa dos equipamentos de iluminação e estimativa do tempo de utilização dos equipamentos, conforme permite a opção A do PIMVPGeração distribuída: Está previsto tempo de 12 meses para acompanhamento do projeto.",1.0472644539717588,"Copel Distribuição S.A., Rua Vicente Machado, Guarapuava, Região Geográfica Imediata de Guarapuava, Região Geográfica Intermediária de Guarapuava, Paraná, Região Sul, 85010-050, Brasil",-25.38696195,-51.474271,Paraná,Guarapuava
57,2024-04-01,COMPANHIA PAULISTA DE FORÇA E LUZ,11684,PE-00063-0186/2019,EE-00063-0186_Fundação Pio XII Ivete_CPP19,Comércio e Serviços,0.0,0.58,637.02,60.62,"Reduzir o desperdício de energia elétrica em hospitais, por meio de implementação de projeto de eficiência energética.",Cumprir metas regulatórias,2019-12-06,2023-08-10,A-Medição Parcial de Retrofit isolado,1.0437934992009843,"Companhia Paulista de Força e Luz, Avenida Sete de Setembro, Vila Pavani, Nova Granada, Região Imediata de São José do Rio Preto, Região Metropolitana de São José do Rio Preto, Região Geográfica Intermediária de São José do Rio Preto, São Paulo, Região Sudeste, 15440-000, Brasil",-20.5356207,-49.3242102,São Paulo,
58,2024-04-01,ELEKTRO REDES SA,5207,PE-00385-0074/2019,Eficiência Energética Saneamento,Serviços Públicos,0.0,0.62,607.16,79.33,Redução do consumo de energia através da substituição de equipamentos e automação de sistemas nos processos de saneamento básico.,"Opção A para sistemas de ilumição, opção B para os sistemas de bombeamento",2019-07-12,2020-07-12,,1.0427205536591453,"Tecnologia Avanzada en Redes. S.A, Carretera a San José Pinula, Condominio Cañadas del Pajon 2, Fraijanes, Santa Catarina Pinula, Departamento de Guatemala, 01052, Guatemala",14.5442807,-90.44272761967392,Departamento de Guatemala,
59,2024-04-01,CELESC DISTRIBUIÇÃO SA,8678,PE-05697-0037/2017,Educação +Eficiente - UNESC,Comércio e Serviços,0.0,0.63,545.5,137.39,"Reduzir a demanda na ponta e o consumo de energia elétrica por meio da eficientização energética dos sistemas de iluminação, de condicionamento ambiental, de aquecimento da água da piscina e de desumidificação do biotério da Universidade do Extremo Sul Catarinense - UNESC, localizada no município de Criciúma  SC",Não se aplica,2017-08-14,2022-06-30,"Iluminação:  opção A do PIMVP. Para a iluminação em geral, será efetuada a medição de potência e demanda por 1 hora antes e 1 hora após a AEE . Para a iluminação externa, será efetuada a medição de potência e demanda  por 1 dia antes e 1 dia após a AEE. O tempo de uso será estimado com base em entrevista com os usuários de cada setor.  O critério adotado para a escolha dos equipamentos é por amostragem em função da potência nominal (existente e proposto).Ar Condicionado, Aquecimento de Piscina e Desumidificadores:  opção B do PIMVP.  Será efetuada a medição 07 dias antes e 07 dias após a AEE. Para o ar condicionado serão medidos: Energia, Temperatura Interna e Externa. Para o sistema de aquecimento da piscina serão medidos  Energia e Temperatura da Água. Para o desumidificador serão medidos Energia, Umidade Interna e Externa, tempo de uso diário. O critério adotado para a escolha dos equipamentos é por amostragem em função da potência nominal (existente e proposto).",1.0423741317801658,"Celesc Distribuição S.A., 2987, Jardim América, Chapecó, Região Geográfica Imediata de Chapecó, Região Geográfica Intermediária de Chapecó, Santa Catarina, Região Sul, 89803-903, Brasil",-27.09851365,-52.64486742525156,Santa Catarina,Chapecó
60,2024-04-01,ELEKTRO REDES SA,8244,PE-00385-0070/2018,SANTA CASA DE MISERICÓRDIA DONA CAROLINA MALHEIROS,Comércio e Serviços,0.0,0.52,639.31,26.6,"O objetivo do projeto de eficiência energética é a redução do consumo de energia no sistema de iluminação, através do uso de tecnologia LED, e com geração de energia cuja fonte será a solar fotovoltaica.","Potência  medida instantaneamente em amostra nos períodos da linha de base e determinação da economia, sendo, portanto, o parâmetro chave- Tempo de utilização  estimado com base em medição mostral por ambiente de acordo com relação passada pelo cliente, sendo, portanto, o parâmetro não chave no cálculo da economia de energia (Iluminação)- Energia  multiplicação da potência medida pelo tempo de funcionamento estimado, em ambos os períodos de medição- Demanda na ponta  multiplicação da potência pela parcela de tempo de funcionamento na ponta- Variáveis independentes: não há.",2018-11-13,2022-05-05,"Opção A do PIMV, com amostragem estatística, no caso do sistema de iluminação, e a opção B, no caso do sistema fotovoltaico.",1.0407401752509795,"Tecnologia Avanzada en Redes. S.A, Carretera a San José Pinula, Condominio Cañadas del Pajon 2, Fraijanes, Santa Catarina Pinula, Departamento de Guatemala, 01052, Guatemala",14.5442807,-90.44272761967392,Departamento de Guatemala,
61,2024-04-01,CELESC DISTRIBUIÇÃO SA,8306,PE-05697-0030/2016,Educação +Eficiente - UNOCHAPECÓ,Comércio e Serviços,0.0,0.51,535.44,129.02,"Reduzir a demanda na ponta e o consumo de energia elétrica por meio da substituição do sistema de iluminação atual, composto por lâmpadas fluorescentes  tubulares, por um novo sistema composto por lâmpadas de LED tubulares com selo Procel-  e da instalação de sistema fotovoltaico (fonte incentivada)",não se aplica,2016-06-20,2020-01-31,"Sistema iluminação: Será adotada a opção A do PIMVP. As lâmpadas serão agrupadas conforme  suas potências e tempo de utilização. As amostragens serão definidas conforme PROPEE 2013 da ANEEL e o PIMVP da EVO, adotando nível de precisão de 10% com confiabilidade de 95%. O coeficiente de variância adotado inicialmente é de 0,5 até que a média real e o desvio padrão real da população possam ser estimados a partir de amostras reais .Sistema fotovoltaico: Opção B do PIMVP_2012, com a medição da potência e do consumo de energia elétrica. A variável independente  é a radiação solar (kWh/m2), obtida através das estações do INMET, tendo como segunda opção a variável de temperatura média ambiente (ºC). A fronteira de medição será a entrada/saída do sistema fotovoltaico. As medições serão realizadas pelo período de 12 meses após a instalação do sistema.",1.0406006442163904,"Celesc Distribuição S.A., 2987, Jardim América, Chapecó, Região Geográfica Imediata de Chapecó, Região Geográfica Intermediária de Chapecó, Santa Catarina, Região Sul, 89803-903, Brasil",-27.09851365,-52.64486742525156,Santa Catarina,Chapecó
62,2024-04-01,COMPANHIA PAULISTA DE FORÇA E LUZ,8335,PE-00063-0157/2019,EE-00063-0157_Fundação Pio XII Infantil_CPP18,Comércio e Serviços,0.0,0.8,605.66,51.8,Reduzir o consumo e as perdas não técnicas de energia elétrica,Cumprir metas regulatórias,2019-02-26,2022-08-10,A-Medição Parcial de Retrofit isolado,1.039927046118375,"Companhia Paulista de Força e Luz, Avenida Sete de Setembro, Vila Pavani, Nova Granada, Região Imediata de São José do Rio Preto, Região Metropolitana de São José do Rio Preto, Região Geográfica Intermediária de São José do Rio Preto, São Paulo, Região Sudeste, 15440-000, Brasil",-20.5356207,-49.3242102,São Paulo,
63,2024-04-01,CELESC DISTRIBUIÇÃO SA,8680,PE-05697-0043/2017,Educação +Eficiente - UDESC Florianópolis,Comércio e Serviços,0.0,0.4,541.84,77.75,Eficientização no sistema de iluminação e instalação de um sistema fotovoltaico no campus de Florianópolis da Universidade do Estado de Santa Catarina - UDESC.,Não se aplica,2017-10-31,2022-04-26,"Para o Sistema de Iluminação será utilizada a Opção A, com a medição de potência e energia diretamente no sistema de iluminação e estimativa de tempo com base no horário de funcionamento da instituição e calendário acadêmico. Para o sistema de geração fotovoltáico será utilizado a Opção A, com o medição da energia gerada durante um ano e a obtensão de variáveis como Irradiancia solar de estações meteorológicas próximas para a estimativa da geração de energia durante a vida útil dos equipamentos.",1.0362828804081106,"Celesc Distribuição S.A., 2987, Jardim América, Chapecó, Região Geográfica Imediata de Chapecó, Região Geográfica Intermediária de Chapecó, Santa Catarina, Região Sul, 89803-903, Brasil",-27.09851365,-52.64486742525156,Santa Catarina,Chapecó
64,2024-04-01,COMPANHIA PAULISTA DE FORÇA E LUZ,8317,PE-00063-0162/2019,EE-00063-0162-UFSCAR-CPP18,Poder Público,0.0,0.68,510.53,67.59,"Reduzir o desperdício de energia elétrica em poder público, por meio de implementação de projeto de eficiência energética.",Cumprir metas regulatórias,2019-03-27,2021-07-10,A-Medição Parcial de Retrofit isolado,1.032292292818867,"Companhia Paulista de Força e Luz, Avenida Sete de Setembro, Vila Pavani, Nova Granada, Região Imediata de São José do Rio Preto, Região Metropolitana de São José do Rio Preto, Região Geográfica Intermediária de São José do Rio Preto, São Paulo, Região Sudeste, 15440-000, Brasil",-20.5356207,-49.3242102,São Paulo,
65,2024-04-01,CELESC DISTRIBUIÇÃO SA,8686,PE-05697-0061/2018,Cidade +Eficiênte Iluminação Pública de Santo Amaro 2,Iluminação Pública,0.0,0.28,466.67,106.54,Substituição de 1510 lâmpadas do sistema de iluminação pública por luminárias LED mais eficientes.,"Devido a inexistência de variável independente, não se faz necessário estabelecer o modelo de consumo utilizando uma análise de regressão",2018-11-30,2022-03-22,"Opção A  Medição isolada de parâmetros chave, neste caso potência consumida.",1.0318198118672588,"Celesc Distribuição S.A., 2987, Jardim América, Chapecó, Região Geográfica Imediata de Chapecó, Região Geográfica Intermediária de Chapecó, Santa Catarina, Região Sul, 89803-903, Brasil",-27.09851365,-52.64486742525156,Santa Catarina,Chapecó
66,2024-04-01,COPEL DISTRIBUIÇÃO SA,9226,PE-02866-0202/2018,PEE_CP_003_2017 ADMINISTRADORA EDUCACIONAL NOVO ATENEU,Comércio e Serviços,0.0,0.37,431.54,133.13,"O projeto tem como objetivo a eficientização energética nos sistemas de iluminação  e Condicionamento Ambiental da Administradora Educacional Nova Ateneu. Com isto, poderemos promover o uso racional e eficiente de energia","Obteremos redução da demanda no horário de ponta (kW) e economia de energia (MWh/ano) em função da redução de consumo (kW/h). Isto possibilitará a COPEL atender novos consumidores sem investimentos adicionais, otimizando o uso do sistema elétrico, preservando o meio ambiente e contribuindo para a sustentabilidade.",2018-09-01,2022-08-04,"Iluminação: Mensuração da potencia ativa dos equipamentos de iluminação e estimativa do tempo de utilização dos equipamentos, conforme permite o PIMVP. No sistema de condicionamento ambiental esta previsto o monitoramento do consumo e das variaveis independentes por um periodo de 168 horas de funcionamento, será adotado a opção A do PIMVP",1.0309980221876798,"Copel Distribuição S.A., Rua Vicente Machado, Guarapuava, Região Geográfica Imediata de Guarapuava, Região Geográfica Intermediária de Guarapuava, Paraná, Região Sul, 85010-050, Brasil",-25.38696195,-51.474271,Paraná,Guarapuava
67,2024-04-01,COMPANHIA PAULISTA DE FORÇA E LUZ,8482,PE-00063-0158/2019,EE-00063-0158_TV TEM Bauru_CPP18,Comércio e Serviços,0.0,0.8,540.87,4.63,Reduzir o desperdício de energia elétrica na tipologia Comércio e Serviços por meio de implementação de projeto de eficiência energética.,Cumprir metas regulatórias,2019-03-29,2022-03-31,A-Medição Parcial de Retrofit isolado,1.0291533256821144,"Companhia Paulista de Força e Luz, Avenida Sete de Setembro, Vila Pavani, Nova Granada, Região Imediata de São José do Rio Preto, Região Metropolitana de São José do Rio Preto, Região Geográfica Intermediária de São José do Rio Preto, São Paulo, Região Sudeste, 15440-000, Brasil",-20.5356207,-49.3242102,São Paulo,
68,2024-04-01,COPEL DISTRIBUIÇÃO SA,8556,PE-02866-0195/2018,PEE_CP_001_2018 Condominio Alphaville Graciosa,Residencial,0.0,0.59,452.54,82.18,"O projeto tem como objetivo a eficientização energética nos sistemas de iluminação da Condominío Alphaville Graciosa  e instalação de Fonte geradora solar fotovoltaica. Com isto, poderemos promover o uso racional e eficiente de energia","Obteremos redução da demanda no horário de ponta (kW) e economia de energia (MWh/ano) em função da redução de consumo (kW/h). Isto possibilitará a COPEL atender novos consumidores sem investimentos adicionais, otimizando o uso do sistema elétrico, preservando o meio ambiente e contribuindo para a sustentabilidade.",2018-09-01,2021-08-19,"Iluminação: Mensuração da potencia ativa dos equipamentos de iluminação e estimativa do tempo de utilização dos equipamentos, conforme permite o PIMVPGeração distribuída: Está previsto tempo de 12 meses para acompanhamento do projeto.",1.0281159846111703,"Copel Distribuição S.A., Rua Vicente Machado, Guarapuava, Região Geográfica Imediata de Guarapuava, Região Geográfica Intermediária de Guarapuava, Paraná, Região Sul, 85010-050, Brasil",-25.38696195,-51.474271,Paraná,Guarapuava
69,2024-04-01,COPEL DISTRIBUIÇÃO SA,10601,PE-02866-0255/2019,PEE_CP_001_2018 - ACSO - Central de Serviço do Aço Ltda,Comércio e Serviços,0.0,0.65,522.63,4.09,"O projeto tem como objetivo a eficientização energética nos sistemas de iluminação  da ACSO - Central de Serviço do Aço Ltda e instalação de Fonte geradora solar fotovoltaica. Com isto, será possível promover o uso racional e eficiente de energia.",,2019-07-23,2022-12-14,"O projeto será avaliado através da aplicação da opção A do PIMVP através do monitoramento de um dos parâmetros chaves, potência ativa em KW e estimativa do período de utilizaçãoGeração distribuída: Está previsto tempo de 12 meses para acompanhamento do projeto.",1.0273461582134382,"Copel Distribuição S.A., Rua Vicente Machado, Guarapuava, Região Geográfica Imediata de Guarapuava, Região Geográfica Intermediária de Guarapuava, Paraná, Região Sul, 85010-050, Brasil",-25.38696195,-51.474271,Paraná,Guarapuava
70,2024-04-01,COMPANHIA PAULISTA DE FORÇA E LUZ,8882,PE-00063-0177/2019,EE_00063_0177_2019- PH-Paulista-I,Comércio e Serviços,0.0,0.71,504.75,8.7,"Reduzir o desperdício de energia elétrica em hospitais, por meio de implementação de projeto de eficiência energética.",Cumprir metas regulatórias,2019-10-21,2022-06-28,A-Medição Parcial de Retrofit isolad,1.0260692086762002,"Companhia Paulista de Força e Luz, Avenida Sete de Setembro, Vila Pavani, Nova Granada, Região Imediata de São José do Rio Preto, Região Metropolitana de São José do Rio Preto, Região Geográfica Intermediária de São José do Rio Preto, São Paulo, Região Sudeste, 15440-000, Brasil",-20.5356207,-49.3242102,São Paulo,
71,2024-04-01,COPEL DISTRIBUIÇÃO SA,10599,PE-02866-0251/2019,PEE_CP_001_2018 - Auto Posto Tulio LTDA,Comércio e Serviços,0.0,0.66,500.86,0.0,Economia de energia e redução de demanda no horário de ponta através da eficientização do sistema de iluminação,,2019-01-08,2022-12-15,"Medição  instantânea de potência ativa de cada grupo de lâmpadas, o tempo de utilização será estimado em cada ambiente típico, conforme permite a opção A do PIMVP",1.0248576943827692,"Copel Distribuição S.A., Rua Vicente Machado, Guarapuava, Região Geográfica Imediata de Guarapuava, Região Geográfica Intermediária de Guarapuava, Paraná, Região Sul, 85010-050, Brasil",-25.38696195,-51.474271,Paraná,Guarapuava
72,2024-04-01,COPEL DISTRIBUIÇÃO SA,11787,PE-02866-0199/2018,PEE_CP_001_2018 Instituição Adventista Sul Brasileira,Comércio e Serviços,0.0,0.46,485.65,11.11,"O projeto tem como objetivo a eficientização energética nos sistemas de iluminação e condicionamento ambiental da Instituição Adventista Sul Brasileira  de Educação e instalação de Fonte geradora solar fotovoltaica. Com isto, poderemos promover o uso racional e eficiente de energia","Obteremos redução da demanda no horário de ponta (kW) e economia de energia (MWh/ano) em função da redução de consumo (kW/h). Isto possibilitará a COPEL atender novos consumidores sem investimentos adicionais, otimizando o uso do sistema elétrico, preservando o meio ambiente e contribuindo para a sustentabilidade.",2018-09-01,2023-06-19,"Iluminação: Serão efetuadas medições instantaneas de cada tipo de equipamento, sendo que estimado o tempo de utilização dos equipamentos conforme permite o protocolo. Condicionamento de ar: Será monitorado o consumo em amostras de cada tipo de equipamento através de medições graficas pelo periodo de 168 horas, será acompanhada as variaveis independentes durante o periodo. A geração distribuida será monitorada pelo periodo de 12 meses conforme PROPEE.",1.0244631583539316,"Copel Distribuição S.A., Rua Vicente Machado, Guarapuava, Região Geográfica Imediata de Guarapuava, Região Geográfica Intermediária de Guarapuava, Paraná, Região Sul, 85010-050, Brasil",-25.38696195,-51.474271,Paraná,Guarapuava
73,2024-04-01,ELEKTRO REDES SA,8331,PE-00385-0050/2017,Saúde Sustentável - Atendimento com Qualidade e Consumo Consciente de Energia Elétrica.,Comércio e Serviços,0.0,0.8,431.31,34.51,Reduzir o consumo de energia elétrica em usos finais voltados para iluminação e geração de energia fotovoltaica.,,2017-07-03,2021-04-20,"Opção A do PIMV, com amostragem estatística e Opção B para a geração de Energia.",1.0214858547607026,"Tecnologia Avanzada en Redes. S.A, Carretera a San José Pinula, Condominio Cañadas del Pajon 2, Fraijanes, Santa Catarina Pinula, Departamento de Guatemala, 01052, Guatemala",14.5442807,-90.44272761967392,Departamento de Guatemala,
