,DatGeracaoConjuntoDados,NomAgente,IdeEmpresaProponenteProjeto,DscCodProjeto,DscTituloProjeto,DscTipologia,VlrCustoTotal,VlrRcbGlobal,VlrEnergiaEconomizadaTotal,VlrRetiradaDemandaPontaTotal,DscObjetivo,DscJustificativa,DatInicioProjeto,DatConclusaoProjeto,DscMetodologiaMv,Score,Address,Latitude,Longitude,Estado,Capital
102,2024-04-01,COMPANHIA ENERGETICA DE ALAGOAS,9040,PE-00044-0016/2019,Inclusao e disseminacao da eficiencia energetica atraves de acoes educativas para estimular o consumo racional.,Baixa Renda,0.0,0.45,3897.37,1516.35,"O projeto Comunidade Eficiente teve como objetivo reduzir o consumo de energia e a demanda no horário de ponta do sistema elétrico por meio da substituição de refrigeradores ineficientes por refrigeradores energeticamente eficientes e de lâmpadas ineficientes e em funcionamento nas unidades consumidoras, além de efetuar cadastros de consumidores na Tarifa Social e no CADÚNICO, bem como ações educativas.",nao se aplica,2019-09-10,2021-11-30,"luminacao opcao A,  Medicao do consumo e estimativa do tempo de uso, Refrigeracao: Opcao B,  Medicao de Todos parametros, ambas de acordo com o Volume I do PIMVP, EVO 10000-1:2012 e Guia de Medicao e Verificacao para o Programa de Eficiencia Energetica Regulado pela Aneel. Para opcao B, o periodo da linha de base sera de uma semana, onde vai medir o consumo a temperatura media interna.",1.4976138589280295,,,,ALAGOAS,MACEIÓ
103,2024-04-01,RGE SUL DISTRIBUIDORA DE ENERGIA SA,8715,PE-00396-0117/2019,PROJETO HOSPITAIS PH-RGE-I,Poder Público,0.0,0.42,4895.31,314.53,"Substituição de 12.000 lâmpadas ineficientes do tipo fluorescentes compactas, fluorescentes tubulares, vapor metálico por outras 12.000 lâmpadas eficientes utilizando tecnologia LED nestas entidades. Adicionalmente serão instalados sistemas de GD em 23 hospitais totalizando 1.334kWp",,2019-10-29,2023-11-10,Será adotado a metodologia A de medição e verificação de performance conforme PIMVP. Adicionalmente para o sistema de GD serão medido por um ano a produção de energia,1.4779948331818273,,,,RIO GRANDE DO SUL,CAXIAS DO SUL
104,2024-04-01,ENERGISA MATO GROSSO DO SUL  DISTRIBUIDORA DE ENERGIA SA,9109,PE-00404-0103/2019,Projeto de Eficiência Energética Nossa Energia 2019-2021,Baixa Renda,0.0,0.43,3385.8,1770.61,"Eficientização dos sistemas de iluminação e refrigeração, através da substituição de lâmpadas incandescentes e/ou fluorescentes compactas por lâmpadas LED e refrigeradores velhos por refrigeradores eficientes , ambos com Selo Procel de Economia de Energia, de residências de clientes tipo baixa renda localizadas em 74 municípios da área de concessão da concessionária.",,2019-03-15,2022-10-31,"A proposta de avaliação dos resultados será baseada no Protocolo Internacional para Medição e Verificação de Performance  PIMVP. O objetivo é garantir que a economia prevista, em termos de energia economizada (kWh/mês) e demanda evitada (kW) sejam atingidas com precisão. Para a realização do plano de Medição e Verificação da unidade consumidora em questão, serão utilizadas as Opção B  Medição isolada de todos os parâmetros e Opção A  Medição isolada de parâmetros chave.",1.4728533551279739,,,,MATO GROSSO,CUIABÁ
108,2024-04-01,RGE SUL DISTRIBUIDORA DE ENERGIA SA,8545,PE-00396-0118/2019,Bônus Refrigerador Inverter RGE,Residencial,0.0,0.53,3717.9,637.5,"Reduzir o desperdício de energia elétrica em residências, por meio de implementação de projeto de eficiência energética, promovendo a tecnologia Inverter",Cumprir metas regulatórias e promover a eficiência energética,2019-11-25,2023-01-10,A-Medição Parcial de Retrofit isolado,1.395773524772051,,,,RIO GRANDE DO SUL,CAXIAS DO SUL
109,2024-04-01,CEMIG DISTRIBUIÇÃO SA,8691,PE-04950-0111/2017,ENERGIA INTELIGENTE - ESCOLAS II,Serviços Públicos,0.0,0.77,3009.98,899.47,Substituição de sistema de iluminação e instalação de sistemas de microgeração fotovoltaica em escolas públicas dentro da área de concessão da CEMIG D.,"O projeto se justifica pela atual situação das escolas públicas, que ainda estão equipadas com lâmpadas ineficientes e reatores eletromagnéticos, e também para aplicação e disseminação dos conceitos e da tecnologia da geração fotovoltaica na sociedade, especialmente para o público estudantil. Pretende-se, também, difundir a cultura de eficiência energética, já que as ações são vistas e experimentadas pelos alunos e comunidade.Este projeto será realizado com recurso disponibilizado e não utilizado na Chamada Pública de Projetos 01/2016, conforme prevê o item 4.6 da seção 3.0 do PROPEE.",2017-12-01,2022-11-07,Será utilizada a metodologia do PIMVP para aferição dos resultados do projeto: opção A para iluminação e opção B para fotovoltaico.,1.352860514513473,,,,MINAS GERAIS,BELO HORIZONTE
111,2024-04-01,CEMIG DISTRIBUIÇÃO SA,8693,PE-04950-0137/2018,Movimentos no Campo,Baixa Renda,0.0,0.43,2600.81,1166.14,"Reduzir o consumo e as perdas não técnicas de energia elétrica em comunidades quilombolas, indígenas e de movimentos sociais.",Estaremos realizando medições individuais de um grupo do clientes e usos finais que possuem a mesma característica de consumo,2018-05-10,2022-10-13,"Opção A do PIMVP, com amostragem estatística, para iluminação e opção B do PIMVP, com amostragem estatísitica, para refrigeração.",1.33914798180387,,,,MINAS GERAIS,BELO HORIZONTE
113,2024-04-01,RGE SUL DISTRIBUIDORA DE ENERGIA SA,11683,PE-00396-0103/2018,Eficientização Hospitais FV 2018,Poder Público,0.0,0.37,3327.44,252.91,"Promover a eficientização em Prédios Públicos, em sistemas de iluminação, e implementação das primeiras usinas fotovoltaicas em hospitais na concessão.",Cumprir metas regulatórias,2018-06-21,2023-08-10,A-Medição Parcial de Retrofit isolado,1.321191781076769,,,,RIO GRANDE DO SUL,CAXIAS DO SUL
114,2024-04-01,CEMIG DISTRIBUIÇÃO SA,8297,PE-04950-0138/2018,Terminal Rodoviário de BH,Serviços Públicos,0.0,0.38,3170.61,363.46,"Substituição de todo o sistema de iluminação obsoleto do Terminal Rodoviário de Belo Horizonte (oficialmente Terminal Rodoviário Governador Israel Pinheiro - TERGIP), por sistema iluminação a LED, incluindo o fornecimento e instalação de materiais e equipamentos eficientes, descarte de equipamentos usados, treinamento, medição e verificação (M&V) em conformidade com o Protocolo Internacional de Medição e Verificação de Performance e relatórios conforme determina a ANEEL.","O projeto se justifica pela atual situação do Terminal Rodoviário de Belo Horizonte, que ainda está equipado com lâmpadas ineficientes e reatores eletromagnéticos. Pretende-se, também, difundir a cultura de eficiência energética, já que as ações são vistas e experimentadas pelos milhares de usuários do terminal.Este projeto será realizado com recurso disponibilizado e não utilizado nas Chamadas Públicas de Projetos, conforme prevê o item 4.6 da seção 3.0 do PROPEE.",2018-06-06,2021-07-30,Será utilizada a opção A da metodologia do PIMVP para aferição dos resultados do projeto.,1.3167383353658888,,,,MINAS GERAIS,BELO HORIZONTE
116,2024-04-01,RGE SUL DISTRIBUIDORA DE ENERGIA SA,8205,PE-00396-0115/2019,Baixa Renda VII,Baixa Renda,0.0,0.22,2247.52,768.36,Reduzir o consumo e as perdas não técnicas de energia elétrica,,2019-05-10,2020-11-10,,1.2668737927357898,,,,RIO GRANDE DO SUL,CAXIAS DO SUL
118,2024-04-01,CEMIG DISTRIBUIÇÃO SA,8057,PE-04950-0090/2017,Sistemas de Soluções para Saneamento - S3,Serviços Públicos,0.0,0.76,2705.21,0.0,Melhoria no gerenciamento das redes de distribuição de água evitando o desperdício de energia elétrica como consequencia da redução do bombeamento de água- Apresentar um diagnóstico energético que permita estabelecer um potencial de otimização dos sistemas avaliados.,"Devido ao consumo dos equipamentos afetados pela ação de eficiência energética serem bastante significativos dentro da instalação das empresas de saneamento, a medição será realizada pelo próprio medidor de faturamento da concessionária de energia. Este mesmo medidor já registra o conumo na ponta.",2017-02-20,2021-11-16,"Opção C do PIMV, com utilização do próprio medidor de faturamento.",1.2369785468628611,,,,MINAS GERAIS,BELO HORIZONTE
119,2024-04-01,EDP ESPIRITO SANTO DISTRIBUIDORA DE ENERGIA SA,8508,PE-00380-0079/2019,Boa Energia na Comunidade,Baixa Renda,0.0,0.68,1908.55,729.23,"Aumentar a eficiência energética dos bairros alvos do projeto, promovendo, em parceria com a comunidade, ações de regularização e substituição de equipamentos residenciais ineficientes.",Realizando medições amostrais de um grupo de  lâmpadas conforme orientação do Guia de M&V.,2019-02-26,2022-02-25,"Opção A  do PIMV, com aplicação do guia de medição e verificação espécifica para uso de iluminação em unidades residenciais baixa renda.",1.2304898726129767,,,,ESPÍRITO SANTO,VITÓRIA
120,2024-04-01,COMPANHIA PAULISTA DE FORA E LUZ,5183,PE-00063-0143/2018,EE-00063-0143-2018_HC RIBEIRÃO PRETO,Poder Público,0.0,0.41,1976.97,225.77,"Reduzir o desperdício de energia elétrica no poder público, por meio de implementação de projeto de eficiência energética.",CUMPRIR METAS REGULATRIAS,2018-05-29,2020-12-30,A-Medição Parcial de Retrofit isolado,1.1886267131043058,,,,SÃO PAULO,SOROCABA
121,2024-04-01,COMPANHIA PIRATININGA DE FORÇA E LUZ,8530,PE-02937-0081/2019,Bônus Refrigerador Inverter RGE,Residencial,0.0,0.35,1726.56,354.04,"Reduzir o desperdício de energia elétrica em residências, por meio de implementação de projeto de eficiência energética, promovendo a tecnologia Inverter",Cumprir metas regulatórias e promover a eficiência energética,2019-10-23,2023-01-10,A,1.176873388576931,,,,SÃO PAULO,SANTOS
122,2024-04-01,RGE SUL DISTRIBUIDORA DE ENERGIA SA,9207,PE-00396-0119/2019,Bônus Motores,Industrial,0.0,0.28,1830.06,246.27,Promover a substituição de motores ineficientes IR1 por motores de alto rendimento IR3 através do incentivo do Bônus Motores,,2019-12-18,2023-01-10,Será aplicado a metodologia A do protocolo internacional de medição e verificação de performance,1.1764624937371415,,,,RIO GRANDE DO SUL,CAXIAS DO SUL
123,2024-04-01,CENTRAIS ELÉTRICAS DE RONDÔNIA SA   CERON,8313,PE-00369-1902/2019,Projeto de Eficiência Energética em Iluminação Pública da cidade de Cacoal,Iluminação Pública,0.0,0.13,1640.78,374.6,Reduzir o consumo de energia elétrica nas principais ruas de Cacoal,,2019-08-13,2021-06-30,Foi escolhida a opção A de acordo com o IPMVP Volume I EVO 10000 1 2012 Br,1.1705973788694202,,,,RONDÔNIA,PORTO VELHO
125,2024-04-01,EDP ESPIRITO SANTO DISTRIBUIDORA DE ENERGIA SA,4928,PE-00380-0077/2018,Projeto EE AEBES Hospital HEVV E JAIME SANTOS,Comércio e Serviços,0.0,0.3,1624.06,189.28,"Reduzir o consumo de energia do Hospital Evangélico de Vila velha com a modernização do sistema de refrigeração e Hospital Jaime Santos Neves localizado na Serra, visando a substituição de  lâmpadas fluoresntes tubulares e refletores por lâmpadas e refletores de LED.",Realizar mediÃÃes amostrais de um grupo de  lÃmpadas conforme orientaÃÃo do guia de M&amp-V e tambÃm no sistema de refrigeraÃÃo.,2018-07-20,2021-03-02,"Opção A  do PIMV, com aplicação do guia de medição e verificação espécifica para uso de iluminação em predios públicos. Opção B para Sistema de ar condicionado.",1.1511554131946962,,,,ESPÍRITO SANTO,VITÓRIA
127,2024-04-01,COMPANHIA PIRATININGA DE FORÇA E LUZ,11674,PE-02937-0080/2019,EE_02937_0080_2019 - PH-Piratininga-I,Comércio e Serviços,0.0,0.87,1484.82,26.0,"Reduzir o desperdício de energia elétrica em hospitais, por meio de implementação de projeto de eficiência energética.",Cumprir metas regulatórias,2019-10-21,2023-08-10,A-Medição Parcial de Retrofit isolado,1.122044427964457,,,,SÃO PAULO,SANTOS
128,2024-04-01,COMPANHIA PAULISTA DE FORA E LUZ,5182,PE-00063-0132/2017,PRJ0132-Eficientização UNICAMP Campinas,Serviços Públicos,0.0,0.9,1326.06,71.42,"Reduzir o desperdício de energia elétrica no serviço público, por meio de implementação de projeto de eficiência energética e geração distribuida.",Atender a Chamada 01/2016 Prioritario de EE e Estratgico de P&amp-D.,2017-06-30,2020-12-30,Opção B - serão medidos todos os parâmetros envolvidos.,1.1111379124745877,,,,SÃO PAULO,SOROCABA
129,2024-04-01,CEB DISTRIBUIÇÃO SA,8295,PE-05160-1812/2018,Programa de Eficiência Energética no Iate Clube de Brasília,Rural,0.0,0.6,1194.09,178.65,"O Iate Clube de Brasília entende que investir em eficiência energética e conservação de energia é um importante passo no fortalecimento de seu compromisso com a sociedade, o planeta e o meio ambiente, além de atingir economia financeira. Através desse projeto os associados terão contato direto com ações de grande impacto e alta viabilidade, podendo este projeto se tornar um catalizador do tema nos demais clubes da região. Com a implantação do projeto, pretende-se reduzir significativamente os gastos da entidade com energia elétrica, além de dar exemplo de sustentabilidade e conservação de energia. Além disso, o projeto pretende:. Contribuir para difusão de uma cultura que privilegia os processos de desenvolvimento sustentáveis, que valorize a conservação de energia, o ambiente e os recursos naturais.. Aumentar a satisfação do ambiente de trabalho contribuindo para melhoria dos serviços prestados à comunidade.",,2018-06-26,2021-02-26,,1.1087572243396013,,,,DISTRITO FEDERAL,BRASÍLIA
130,2024-04-01,NEOENERGIA DISTRIBUIÇÃO BRASÍLIA SA,8577,PE-05160-1818/2018,Projeto de Eficiência Energética no SERPRO Sede,Comércio e Serviços,0.0,0.43,1143.68,205.82,"Com a implantação do projeto, pretende-se reduzir significativamente os gastos da entidade com energia elétrica, além de dar exemplo de sustentabilidade e conservação de energia. Além disso, o projeto pretende: ? Contribuir para difusão de uma cultura que privilegia os processos de desenvolvimento sustentáveis, que valorize a conservação de energia, o ambiente e os recursos naturais. ? Aumentar a satisfação do ambiente de trabalho contribuindo para melhoria dos serviços prestados à comunidade. As ações de eficiência energética previstas neste Projeto contemplam os sistemas de Iluminação, Condicionamento Ambiental e Sistemas Motrizes, além da implantação de uma micro central de geração fotovoltaica, com potência instalada de 32,50 kWp.",,2018-07-03,2022-02-28,,1.1065208786541896,,,,DISTRITO FEDERAL,BRASÍLIA
133,2024-04-01,ENERGISA MATO GROSSO DO SUL  DISTRIBUIDORA DE ENERGIA SA,4868,PE-00404-0105/2019,Projeto de Eficiência Energética na Fundação de Serviços de Saúde de MS,Poder Público,0.0,0.48,1073.17,157.92,"Eficientização dos sistemas de iluminação e condicionamento de ar, através da substituição de luminárias e lâmpadas convencionais por luminárias e lâmpadas de alta eficiência e substituição de equipamentos de ar condicionado de baixo rendimento por equipamentos de ar condicionado eficientes.",,2019-03-28,2020-11-30,,1.0951264856847573,,,,MATO GROSSO,CUIABÁ
134,2024-04-01,COMPANHIA PIRATININGA DE FORÇA E LUZ,8938,PE-02937-0068/2018,EE-02937-0068-2018_Hospitais FV,Poder Público,0.0,0.8,1083.25,0.0,"Reduzir o desperdício de energia elétrica no poder público, por meio de implementação de projeto de eficiência energética.",Cumprir metas regulatórias,2018-06-13,2022-09-10,A-Medição Parcial de Retrofit isolado,1.0809000938546682,,,,SÃO PAULO,SANTOS
135,2024-04-01,ENERGISA MATO GROSSO DISTRIBUIDORA DE ENERGIA S A,9160,PE-00405-0077/2018,"Economia em Foco - Eficientização das Policlínicas Municipais Coxipó, Planalto e Upa Morada do Ouro",Poder Público,0.0,0.75,1013.51,44.31,"O Projeto de Eficiência Energética nas Policlínicas, visa melhorias do sistema de iluminação, realizando a troca de lâmpadas ineficientes por lampadas LED mais eficientes, troca de condicionadores de ar e a instalação de fontes incentivadas sendo geração solar.",Será realizada a medição por amostragem,2018-12-10,2024-08-31,,1.0784530081928774,,,,MATO GROSSO,CUIABÁ
136,2024-04-01,CEB DISTRIBUIÇÃO SA,10514,PE-05160-1501/2016,Projeto de Eficiência Energética da Aneel,Poder Público,0.0,0.58,936.77,82.0,"O projeto tem como objetivos específicos: .Melhoria na iluminação da Agência em praticamente 100% das instalações, trocando lâmpadas fluorescentes tubulares, fluorescentes compactas, vapor de mercúrio e vapor de sódio por lâmpadas LED e instalação de fotossensores e sensores de presença- .Instalação da capacidade máxima em painéis fotovoltaicos estimada em 512 kWp- .Modificação dos elementos de refrigeração central: torre de refrigeração, chillers, bombas e ventiladores dos Fan Coils. Os Fan Coils serão mantidos em sua estrutura básica, e apenas seus filtros e ventiladores internos serão trocados. Os VRFs existentes serão diminuídos em sua quantidade total.","O projeto surge com a motivação de divulgar ações de eficiência energética em prédios públicos. Esse modelo de projeto visa a inserção do contrato de desempenho no setor, de tal forma que o dinheiro investido será devolvido e poderá ser investido em novos projetos.O projeto em questão foi classificado como Piloto, pois visa testar novas práticas  atente para o trecho e ou práticas existente no início da Seção 5.3 do PROPEE. A nova prática desse projeto está na celebração de um Contrato de Desempenho (CD) por consumidor da classe Poder Público. Nenhuma instituição pública no Brasil está conseguindo realizar um CD a contento por razões legais: a lei nº 8.666/93 é um empecilho por não enxergar a economia de energia como um bem pelo qual se deve pagar. Essa economia é, afinal, um bem abstrato, e a lei tem dificuldade de enxergar isso.",2016-11-21,2021-11-03,"A avaliação será feita com a análise das medições realizadas antes e depois da         implementação do projeto. Segundo o PROPEE, devido à característica de atender muitos         pontos de eficientização, as ações de MeV deverão ser realizadas por amostragem. O tamanho         da amostra será baseado nas orientações do Guia de Medição e Verificação para o Programa de Eficência Energética Regulado pela ANEEL.         Os equipamentos que farão parte da amostra deverão ser escolhidos aleatoriamente.         Estão previstas as seguintes atividades:         Medição de  economia de energia e redução de demanda na ponta em todos os usos finais do projeto.         Análise e elaboração de relatório de medição e verificação conclusivo acerca da Redução da Demanda na Ponta (kW) e Energia Economizada (MWh/ano) obtidas com a iniciativa.         A metodologia recomendada segue a opção A do PIMVP (Protocolo Internacional para Medição e Verificação de Performance).",1.0746952930889477,,,,DISTRITO FEDERAL,BRASÍLIA
137,2024-04-01,CEMIG DISTRIBUIÇÃO SA,8071,PE-04950-0108/2017,Eficiência Energética do Minas Tênis Clube Unidade II,Comércio e Serviços,0.0,0.61,849.55,165.19,Promover a redução de consumo de energia elétrica do Minas Tênis Clube Unidade II  - Bairro Serra,SIL - Sistema de Iluminação e SAS - Sistema de Aquecimento Solar obsoletos,2017-08-31,2021-11-18,"Opção A do PIMV, com amostragem estatística",1.07430749304109,,,,MINAS GERAIS,BELO HORIZONTE
138,2024-04-01,COMPANHIA PAULISTA DE FORA E LUZ,8018,PE-00063-0187/2019,EE_00063_0187_PUCC_CPP19,Comércio e Serviços,0.0,0.53,910.19,103.19,"Reduzir o consumo de energia elétrica e demanda na ponta com a eficientização do sistema de iluminação das áreas administrativas e do hospital, através da substituição dos equipamentos antigos(Lâmpadas Fluorescentes Tubulares e Compactas) por modelos LED. O projeto também contou com Geração de Energia através da implantação de um sistema Fotovoltaico de69,12 kWp no Campus I.",Cumprir metas regulatrias,2019-11-12,2022-01-22,A-Medição Parcial de Retrofit isolado,1.0741766225534757,,,,SÃO PAULO,SOROCABA
139,2024-04-01,ENERGISA SULSUDESTE DISTRIBUIDORA DE ENERGIA SA,8538,PE-05216-0046/2019,Projeto Piloto do Programa de Eficiência Energética através da Compostagem de Resíduos de Poda Arbórea Urbana em Adamantina,Poder Público,0.0,0.59,445.09,561.98,"Evitar o uso de energia eletrica na produção de adubos minerais, com a doação de adubo orgânico produzido através de resídou de poda de árvore",Estaremos realizando medições individuais em cada lote de adubo produzido,2019-02-18,2021-12-31,"Opção A do PIMV, com amostragem estatística",1.0735694219822645,,,,SÃO PAULO,PRESIDENTE PRUDENTE
140,2024-04-01,CEMIG DISTRIBUIÇÃO SA,5149,PE-04950-0128/2018,Eficientização Energética de I.P. em Elói Mendes,Iluminação Pública,0.0,0.8,763.58,174.33,"Substituição dos atuais equipamentos de iluminação pública por luminárias LED, de menor potência.",Projeto selecionado através da Chamada Pública de Projetos - CPP 2017.,2018-04-01,2020-09-25,"A opção escolhida para a realização do M&V foi a opção A, com medição da potência da lâmpada e estimando  o tempo com o cliente através de através de metodologia rastreável. Serão utilizados analisadores de redes portátil, luxímetros digitais, e outros medidores, se necessário. O projeto prevê alterações, se for necessário, para atingir a precisão e confiabilidade definida.",1.0669142727738705,,,,MINAS GERAIS,BELO HORIZONTE
142,2024-04-01,ENERGISA MATO GROSSO DO SUL  DISTRIBUIDORA DE ENERGIA SA,5093,PE-00404-0087/2018,Centro de Convenes Arquiteto Rubens Gil de Camillo,Poder Público,0.0,0.41,802.44,53.49,"O projeto tem como objetivo a eficientizao dos sistemas de iluminao e condicionamento de ar, atravs da substituio de luminrias e lmpadas convencionais por luminrias e lmpadas de alta eficincia e substituio de equipamentos de ar condicionado de baixo rendimento por equipamentos de ar condicionado eficientes, com Selo Procel de Economia de Energia.",,2018-05-09,2019-07-31,"A proposta de avaliação dos resultados será baseada no Protocolo Internacional para Medição e Verificação de Performance  PIMVP. O objetivo é garantir que a economia prevista, em termos de energia economizada e demanda evitada sejam atingidas com precisão. Para a realização do plano de Medição e Verificação da unidade consumidora em questão, será utilizada a Opção C  Medição em toda a instalação.",1.0590254767631109,,,,MATO GROSSO,CUIABÁ
143,2024-04-01,ENERGISA SULSUDESTE DISTRIBUIDORA DE ENERGIA SA,4917,PE-05216-0080/2019,Eficientização da Iluminação Pública de Adamantina - SP,Iluminação Pública,0.0,0.15,710.27,139.64,"As metas de economia do consumo de energia elétrica e de redução da demanda na ponta estão associadas à substituição e descarte de 700 lâmpadas obsoletas, bem como reatores e luminárias, em favor da instalação de luminárias LED IP energeticamente eficientes, as quais oferecem a potência mínima necessária para o alcance dos níveis de iluminância determinados pela NBR 5101/2012.","Ambas de acordo com o Volume I do PIMVP, EVO 10000-1:2012.",2019-08-01,2020-08-02,,1.0584461823988176,,,,SÃO PAULO,PRESIDENTE PRUDENTE
145,2024-04-01,RGE SUL DISTRIBUIDORA DE ENERGIA SA,9289,PE-00396-0114/2019,Eficientização Prédios Públicos II,Poder Público,0.0,0.57,769.78,35.31,Eficientização de prédios públicos através da substituição de lâmpadas e instalação de sistema solar fotovoltaico.,Cumprir metas regulatórias.,2019-06-03,2022-08-10,Opção A - PIMVP,1.0541332300055235,,,,RIO GRANDE DO SUL,CAXIAS DO SUL
146,2024-04-01,ENERGISA SULSUDESTE DISTRIBUIDORA DE ENERGIA SA,4924,PE-05216-0085/2019,EficientizaÃ§Ã£o da IluminaÃ§Ã£o PÃºblica de BraganÃ§a Paulista - SP,Iluminação Pública,0.0,0.18,651.22,148.68,"As metas de economia do consumo de energia elÃ©trica e de reduÃ§Ã£o da demanda na ponta estÃ£o associadas Ã  substituiÃ§Ã£o e descarte de 572 lÃ¢mpadas obsoletas, bem como reatores e luminÃ¡rias, em favor da instalaÃ§Ã£o de luminÃ¡rias LED IP energeticamente eficientes, as quais oferecem a potÃªncia mÃ­nima necessÃ¡ria para o alcance dos nÃ­veis de iluminÃ¢ncia determinados pela NBR 5101/2012.","Ambas de acordo com o Volume I do PIMVP, EVO 10000-1:2012.",2019-08-01,2020-08-02,,1.0536338051299947,,,,SÃO PAULO,PRESIDENTE PRUDENTE
147,2024-04-01,ENERGISA SULSUDESTE DISTRIBUIDORA DE ENERGIA SA,4890,PE-05216-0047/2019,EficientizaÃ§Ã£o da Fagor,Industrial,0.0,0.3,642.95,85.78,"As metas de economia do consumo de energia elÃ©trica e de reduÃ§Ã£o da demanda na ponta estÃ£o associadas Ã  substituiÃ§Ã£o e descarte de 74 lÃ¢mpadas obsoletas, bem como reatores e luminÃ¡rias, em favor da instalaÃ§Ã£o de lÃ¢mpadas/luminÃ¡rias LED energeticamente eficientes, as quais oferecem a potÃªncia mÃ­nima necessÃ¡ria para o alcance dos nÃ­veis de iluminÃ¢ncia determinados pela NBR 5101/2012.","Ambas de acordo com o Volume I do PIMVP, EVO 10000-1:2012.",2019-02-21,2020-02-20,,1.0467852370391706,,,,SÃO PAULO,PRESIDENTE PRUDENTE
149,2024-04-01,ENERGISA ACRE DISTRIBUIDORA DE ENERGIA SA,5186,PE-00026-0001/2017,Eficincia Energtica e Uso Racional de Energia na Universidade Federal do Acre,Serviços Públicos,0.0,0.56,574.61,124.49,Reduo do consumo de energia da Universidade Federal do Acre atravs da realizao de aes Eficincia Enrgica como o retrofit dos sistemas de iluminao e a implantao de microgerao distribuda.,,2017-09-05,2020-07-05,,1.0439339925185704,,,,ACRE,RIO BRANCO
