,DatGeracaoConjuntoDados,NomAgente,IdeEmpresaProponenteProjeto,DscCodProjeto,DscTituloProjeto,DscTipologia,VlrCustoTotal,VlrRcbGlobal,VlrEnergiaEconomizadaTotal,VlrRetiradaDemandaPontaTotal,DscObjetivo,DscJustificativa,DatInicioProjeto,DatConclusaoProjeto,DscMetodologiaMv,Score,Address,Latitude,Longitude,Estado,Capital
74,2024-04-01,ELEKTRO REDES SA,8103,PE-00385-0064/2018,"Eficientização do parque de iluminação e instalação de usina solar fotovoltaica na Universidade Federal de São Carlos - Campi de Araras, SP",Poder Público,0.0,0.6,372.12,89.68,Demonstrar a importância e a viabilidade econômica das ações de eficiência energética no uso final de energia pela comparação entre os resultados econômicos vis a vis os investimentos realizados tanto do ponto de vista do sistema elétrico quanto do ponto de vista do cliente.,"Iluminação: Os cálculos das economias serão realizados conforme item 3  ILUMINAÇÃO, da Seção 4.2 do Módulo 4- Tipologias de Projetos do PROPEE  Programa de Eficiência Energética da ANEEL.Sistema Fotovoltaico: A economia gerada pela Usina Fotovoltaica será calculada através do ponto de vista do consumidor, considerando a energia gerada no período de medição e o CEE de acordo com o preço final da energia paga pelo consumidor, incluindo impostos e encargos (Item 3.4, seção 6.2, módulo 6 do PROPEE).",2018-06-15,2021-01-07,"Iluminação: Opção A do PIMV, com amostragem estatísticaSistema Fotovoltaico: Opção B do PIMV, com a medição de todos os parâmetros chave para cálculo de Consumo de Energia Evitado",1.0210990169958423,"Tecnologia Avanzada en Redes. S.A, Carretera a San José Pinula, Condominio Cañadas del Pajon 2, Fraijanes, Santa Catarina Pinula, Departamento de Guatemala, 01052, Guatemala",14.5442807,-90.44272761967392,Departamento de Guatemala,
75,2024-04-01,COPEL DISTRIBUIÇÃO SA,11789,PE-02866-0212/2018,PEE_CP_001_2018 Clube Duque de Caxias,Comércio e Serviços,0.0,0.49,322.78,138.72,"O projeto tem como objetivo a eficientização energética nos sistemas de iluminação do Clube Duque de Caxias e instalação de Fonte geradora solar fotovoltaica. Com isto, poderemos promover o uso racional e eficiente de energia","Obteremos redução da demanda no horário de ponta (kW) e economia de energia (MWh/ano) em função da redução de consumo (kW/h). Isto possibilitará a COPEL atender novos consumidores sem investimentos adicionais, otimizando o uso do sistema elétrico, preservando o meio ambiente e contribuindo para a sustentabilidade.",2018-09-01,2023-06-20,no sistema de iluminação serão realizadas medições instantâneas de potencia ativa ao mesmo passo que o tempo de utilização dos ambientes típicos serão estimados conforme permite a opção A do PIMVP. O sistema de Geração Distribuída será monitorado pelo período de 12 meses.,1.0210701485059273,"Copel Distribuição S.A., Rua Vicente Machado, Guarapuava, Região Geográfica Imediata de Guarapuava, Região Geográfica Intermediária de Guarapuava, Paraná, Região Sul, 85010-050, Brasil",-25.38696195,-51.474271,Paraná,Guarapuava
76,2024-04-01,COPEL DISTRIBUIÇÃO SA,11790,PE-02866-0223/2018,PEE_CP_003_2017 PM Curitiba - Palácio 29 de Março,Poder Público,0.0,0.51,408.73,20.83,"O projeto tem como objetivo a eficientização energética nos sistemas de Iluminação da Prefeitura de Curitiba. e instalação de Fonte geradora solar fotovoltaica. Com isto, poderemos promover o uso racional e eficiente de energia","Obteremos redução da demanda no horário de ponta (kW) e economia de energia (MWh/ano) em função da redução de consumo (kW/h). Isto possibilitará a COPEL atender novos consumidores sem investimentos adicionais, otimizando o uso do sistema elétrico, preservando o meio ambiente e contribuindo para a sustentabilidade.",2018-09-01,2023-05-26,"Iluminação: Mensuração da potencia ativa dos equipamentos de iluminação e estimativa do tempo de utilização dos ambientes tipicos, conforme permite a opção A do PIMVPGeração distribuída: Está previsto tempo de 12 meses para acompanhamento do projeto.",1.017996616612982,"Copel Distribuição S.A., Rua Vicente Machado, Guarapuava, Região Geográfica Imediata de Guarapuava, Região Geográfica Intermediária de Guarapuava, Paraná, Região Sul, 85010-050, Brasil",-25.38696195,-51.474271,Paraná,Guarapuava
77,2024-04-01,COPEL DISTRIBUIÇÃO SA,8119,PE-02866-0183/2017,PEE CP 001/2016 Tribunal Regional Eleitoral,Poder Público,0.0,0.78,307.17,109.12,O projeto teve como objetivo a eficientização energética no sistema de iluminação e condicionamento ambiental do  Tribunal Regional Eleitoral do Paraná. .,"Obteremos redução da demanda no horário de ponta (kW) e economia de energia (MWh/ano) em função da redução de consumo (kW/h). Isto possibilitará a COPEL atender novos consumidores sem investimentos adicionais, otimizando o uso do sistema elétrico, preservando o meio ambiente e contribuindo para a sustentabilidade.",2017-09-11,2020-07-30,"Iluminação : Serão realizadas medições instântaneas de tempo em amostras de cada tipo de equipamento, o tempo será estimado conforme permite a opção A do PIMVPCondicionamento ambiental: Será avaliado através de medições graficas por um periodo de 168 horas, onde será monitorado o consumo energético e uma das variaveis de influência de consumo.",1.016719667075744,"Copel Distribuição S.A., Rua Vicente Machado, Guarapuava, Região Geográfica Imediata de Guarapuava, Região Geográfica Intermediária de Guarapuava, Paraná, Região Sul, 85010-050, Brasil",-25.38696195,-51.474271,Paraná,Guarapuava
78,2024-04-01,CELESC DISTRIBUIÇÃO SA,8091,PE-05697-0060/2018,Cidade +Eficiênte Iluminação Pública de Pomerode,Iluminação Pública,0.0,0.31,333.67,76.18,Substituição de 500 lâmpadas do sistema de iluminação pública por luminárias LED mais eficientes.,"Devido a inexistência de variável independente, não se faz necessário estabelecer o modelo de consumo utilizando uma análise de regressão",2018-12-18,2021-01-11,"Opção A  Medição isolada de parâmetros chave, neste caso potência consumida.",1.0160999568255695,"Celesc Distribuição S.A., 2987, Jardim América, Chapecó, Região Geográfica Imediata de Chapecó, Região Geográfica Intermediária de Chapecó, Santa Catarina, Região Sul, 89803-903, Brasil",-27.09851365,-52.64486742525156,Santa Catarina,Chapecó
79,2024-04-01,CELESC DISTRIBUIÇÃO SA,10588,PE-05697-0052/2018,Educação +Eficiente - FURB 2018,Comércio e Serviços,0.0,0.38,342.73,55.44,Continuação da Eficentização do sistema de iluminação (substituição de 616 lâmpadas fluorescentes de 40W e  8795 lâmpadas fluorescentes de 32W por 9411 lâmpadas tuboled de 18W- e substituição de 46 lâmpadas fluorescentes de 20W e 1085 lâmpadas fluorescentes de 16W por 1131 lâmpadas tuboleds de 10W) e ainda a instalação de sistema de geração incentivada (fotovoltaica) de 48kWp.,"A instalação da planta fotovoltaica será regionalmente significativa (será a maior da cidade), além de trazer um impacto positivo por ser em uma instituição superior de ensino, o que contribuirá na formação de profissionais técnicos.",2018-06-26,2023-01-27,"Para o sistema de Iluminação será utilizada a Opção A do PIMVP, com medição por amostragem de cada grupo de luminárias, agrupadas por potência elétrica e número de lâmpadas. Para a geração por fonte incentivada será utilizada a Opção B do PIMVP, com a medição de todo o sistema.",1.0149760102848806,"Celesc Distribuição S.A., 2987, Jardim América, Chapecó, Região Geográfica Imediata de Chapecó, Região Geográfica Intermediária de Chapecó, Santa Catarina, Região Sul, 89803-903, Brasil",-27.09851365,-52.64486742525156,Santa Catarina,Chapecó
80,2024-04-01,CENTRAIS ELETRICAS DO PARA,9307,PE-00371-0019/2017,EFICIENTIZAÇÃO DO SISTEMA DE ILUMINAÇÃO E CONDICIONAMENTO AMBIENTAL DO TRIBUNAL DE JUSTIÇA DO ESTADO DO PARA,Poder Público,0.0,0.73,326.04,47.22,Implantação de ações de eficiência energética através substituição do sistema de iluminação e condicionamento ambiental substituindo equipamentos ineficientes existentes por equipamentos eficientes com tecnologia a LED.,Estaremos realizando medições individuais de um grupo de amostras com característica de consumo,2017-11-30,2018-11-30,,1.0125789633389424,"Centrais Elétricas do Pará, Alameda NS 10, Conjunto Jardim Maguari, Coqueiro, Belém, Região Geográfica Imediata de Belém, Região Geográfica Intermediária de Belém, Pará, Região Norte, 66823-077, Brasil",-1.3363303,-48.44656919031406,Pará,Belém
81,2024-04-01,COPEL DISTRIBUIÇÃO SA,8176,PE-02866-0211/2018,PEE_CP_001_2018 Alphaville Graciosa Clube,Comércio e Serviços,0.0,0.65,294.89,64.33,"O projeto tem como objetivo a eficientização energética nos sistemas de iluminação do Alphaville Graciosa CIube e instalação de Fonte geradora solar fotovoltaica. Com isto, poderemos promover o uso racional e eficiente de energia","Obteremos redução da demanda no horário de ponta (kW) e economia de energia (MWh/ano) em função da redução de consumo (kW/h). Isto possibilitará a COPEL atender novos consumidores sem investimentos adicionais, otimizando o uso do sistema elétrico, preservando o meio ambiente e contribuindo para a sustentabilidade.",2018-09-01,2022-05-14,"Iluminação: Mensuração da potencia ativa dos equipamentos de iluminação e estimativa do tempo de utilização dos ambientes típicos, conforme permite a opção A do PIMVP. Geração distribuída: Está previsto tempo de 12 meses para acompanhamento do projeto, neste periodo será realizado o acompanhamento das variaveis independentes caso seja necessário efetuar algum ajuste.",1.0112279180109225,"Copel Distribuição S.A., Rua Vicente Machado, Guarapuava, Região Geográfica Imediata de Guarapuava, Região Geográfica Intermediária de Guarapuava, Paraná, Região Sul, 85010-050, Brasil",-25.38696195,-51.474271,Paraná,Guarapuava
82,2024-04-01,COPEL DISTRIBUIÇÃO SA,11788,PE-02866-0206/2018,PEE_CP_001_2018 Instituto Filadelfia de Londrina,Comércio e Serviços,0.0,0.45,288.84,52.54,"O projeto tem como objetivo a eficientização energética nos sistemas de iluminação do Instituto Filadelfia de Londrina e instalação de Fonte geradora solar fotovoltaica. Com isto, poderemos promover o uso racional e eficiente de energia","Obteremos redução da demanda no horário de ponta (kW) e economia de energia (MWh/ano) em função da redução de consumo (kW/h). Isto possibilitará a COPEL atender novos consumidores sem investimentos adicionais, otimizando o uso do sistema elétrico, preservando o meio ambiente e contribuindo para a sustentabilidade.",2018-09-01,2023-06-19,"Iluminação: Mensuração da potencia ativa dos equipamentos de iluminação e estimativa do tempo de utilização dos equipamentos, conforme permite a opção A do PIMVPGeração distribuída: Está previsto tempo de 12 meses para acompanhamento do projeto.",1.00951120514398,"Copel Distribuição S.A., Rua Vicente Machado, Guarapuava, Região Geográfica Imediata de Guarapuava, Região Geográfica Intermediária de Guarapuava, Paraná, Região Sul, 85010-050, Brasil",-25.38696195,-51.474271,Paraná,Guarapuava
83,2024-04-01,COPEL DISTRIBUIÇÃO SA,9319,PE-02866-0256/2019,Associação Paranaense de Cultura APC - PUC LONDRINA,Comércio e Serviços,0.0,0.69,270.38,66.62,"O projeto tem como objetivo a eficientização energética nos sistemas de Climatização ambiental da PUC Londrina. Com isto, será possível promover o uso racional e eficiente de energia.",,2019-07-23,2022-10-24,"O projeto será avaliado através da aplicação da opção A do PIMVP através do monitoramento de um dos parâmetros chaves, potência ativa em KW e estimativa do período de utilização.",1.0090897251912216,"Copel Distribuição S.A., Rua Vicente Machado, Guarapuava, Região Geográfica Imediata de Guarapuava, Região Geográfica Intermediária de Guarapuava, Paraná, Região Sul, 85010-050, Brasil",-25.38696195,-51.474271,Paraná,Guarapuava
84,2024-04-01,COPEL DISTRIBUIÇÃO SA,8198,PE-02866-0264/2019,PEE_CP_001_2018 - Associação Paranaense de Cultura -Toledo,Comércio e Serviços,0.0,0.63,254.71,73.48,Economia de energia e redução de demanda no horário de ponta através da eficientização do sistema de condicionamento ambiental,,2019-07-23,2022-05-16,"Medição da potência ativa através de medições gráficas de 7 dias de funcionamento, sendo que as variáveis independentes serão acompanhadas por igual período",1.0082419538707192,"Copel Distribuição S.A., Rua Vicente Machado, Guarapuava, Região Geográfica Imediata de Guarapuava, Região Geográfica Intermediária de Guarapuava, Paraná, Região Sul, 85010-050, Brasil",-25.38696195,-51.474271,Paraná,Guarapuava
85,2024-04-01,ELEKTRO  ELETRICIDADE E SERVIÇOS SA,10532,PE-00385-0048/2016,Geração Distribuída Solar,Residencial,0.0,1.3,306.54,3.45,Analisar de forma robusta a inserção e operacionalização da Geração Distribuída dentro dos Projetos de Eficiência Energética,Serão realizadas medições individuais de um grupo do clientes que possuem a mesma característica de consumo,2016-12-28,2021-12-27,Industrial: Opção B  Medição isolada de todos os parâmetros. Comercial e Residencial: Opção A  Medição isolada de parâmetros chave,1.0064905988158788,"Elektro Eletricidade e Serviços S.A., Rua Brasília, Teodoro Sampaio, Região Imediata de Presidente Prudente, Região Geográfica Intermediária de Presidente Prudente, São Paulo, Região Sudeste, Brasil",-22.52740505,-52.15899825,São Paulo,
86,2024-04-01,ELEKTRO REDES SA,11933,PE-00385-0077/2019,Eficiência Energética na Santa Casa de Jales,Comércio e Serviços,0.0,0.67,293.57,6.36,"Eficientização do sistema de iluminação da Santa Casa de Jales, unidade consumidora da tipologia Comércio e Serviços, com substituição de lâmpadas de tecnologia antiga por lâmpadas LED mais eficientes. Implantação de um sistema de geração com fonte incentivada na Santa Casa de Jales.",,2019-09-13,2023-07-14,"Uso Final Iluminação: Opção A do PIMVP, com medição da potência por amostragem e estimativa do tempo. Fontes Incentivadas: Opção B do PIMVP, medição isolada de todos os parâmetros envolvidos na geração de energia. A energia gerada será medida durante 12 meses. A variável independente a ser considerada será a radiação solar.",1.0055225421207306,"Tecnologia Avanzada en Redes. S.A, Carretera a San José Pinula, Condominio Cañadas del Pajon 2, Fraijanes, Santa Catarina Pinula, Departamento de Guatemala, 01052, Guatemala",14.5442807,-90.44272761967392,Departamento de Guatemala,
87,2024-04-01,COPEL DISTRIBUIÇÃO SA,8190,PE-02866-0234/2019,PEE_CP_001_2018 Carlópolis,Iluminação Pública,0.0,0.72,236.11,49.32,Eficientização do parque de iluminação publica do Municipio de Carlópolis,,2019-09-30,2021-08-19,Serão realizadas medições pontuais instantânea da potencia ativa e será estimado o tempo de funcionamento das lâmpadas conforme permite o protocolo de medição e verificação de performance.,1.004127231774841,"Copel Distribuição S.A., Rua Vicente Machado, Guarapuava, Região Geográfica Imediata de Guarapuava, Região Geográfica Intermediária de Guarapuava, Paraná, Região Sul, 85010-050, Brasil",-25.38696195,-51.474271,Paraná,Guarapuava
88,2024-04-01,ELEKTRO REDES SA,8242,PE-00385-0079/2019,Eficiência Energética na UNESP Rio Claro,Poder Público,0.0,0.42,215.58,50.6,"Eficientização do sistema de iluminação externa da UNESP Campus Rio Claro, unidade consumidora da tipologia Poder Público, com substituição de luminárias e refletores de tecnologia antiga por refletores e luminárias LED mais eficientes",,2019-09-13,2021-12-31,"Uso Final Iluminação: Opção A do PIMVP, com medição da potência por amostragem e estimativa do tempo. Potência  medida instantaneamente em amostra nos períodos da linha de base e determinação da economia, sendo, portanto, o parâmetro chave- Tempo de utilização  estimado com base em medição amostral por ambiente de acordo com relação passada pelo cliente, sendo, portanto, o parâmetro não chave no cálculo da economia de energia (Iluminação)- Energia  multiplicação da potência medida pelo tempo de funcionamento estimado, em ambos os períodos de medição- Demanda na ponta  multiplicação da potência pela parcela de tempo de funcionamento na ponta- Variáveis independentes: não há.",1.0022748370052983,"Tecnologia Avanzada en Redes. S.A, Carretera a San José Pinula, Condominio Cañadas del Pajon 2, Fraijanes, Santa Catarina Pinula, Departamento de Guatemala, 01052, Guatemala",14.5442807,-90.44272761967392,Departamento de Guatemala,
89,2024-04-01,COPEL DISTRIBUIÇÃO SA,8152,PE-02866-0177/2017,PEE CP 001/2016 BANCO CENTRAL DO BRASIL,Poder Público,0.0,0.43,235.63,27.82,"Eficientização energética no sistema de iluminação do Banco Central do Brasil, e com isto, promover o uso eficiente de energia no setor público.","Obteremos redução da demanda no horário de ponta (kW) e economia de energia (MWh/ano) em função da redução de consumo (kW/h). Isto possibilitará a COPEL atender novos consumidores sem investimentos adicionais, otimizando o uso do sistema elétrico, preservando o meio ambiente e contribuindo para a sustentabilidade.",2017-07-01,2020-08-30,"A estratégia e avaliação deste projeto é de acordo com o Procedimentos do Programa de Eficiência Energética (PROPEE ou Manual ANEEL), de 27/09/2013, e o Protocolo Internacional de Medição e Verificação de Performance (PIMVP), janeiro de 2012  EVO 10000- 1:2012.Será elaborada a consolidação da estratégia de M & V durante a fase de diagnóstico energético (projeto de eficiência energética propriamente dito), o qual será submetido à aprovação da COPEL, cujo propósito do mesmo é fazer a avaliação do projeto mediante a realização de medições, para obter os valores da energia economizada (kWh) e a redução de demanda no horário de ponta (kW). De forma a evitar possíveis desvios de medições, preferencialmente os pontos de medição deverão ser os mesmos, tanto para a fase inicial (antes), quanto para a final (após).",1.0020121337470722,"Copel Distribuição S.A., Rua Vicente Machado, Guarapuava, Região Geográfica Imediata de Guarapuava, Região Geográfica Intermediária de Guarapuava, Paraná, Região Sul, 85010-050, Brasil",-25.38696195,-51.474271,Paraná,Guarapuava
90,2024-04-01,COPEL DISTRIBUIÇÃO SA,10603,PE-02866-0226/2018,PEE_CP_003_2017 COAPROCOR - Cooperativa Agroindustrial,Industrial,0.0,0.53,252.49,0.75,"O projeto tem como objetivo a eficientização energética nos sistemas de Iluminação da COAPROCOR (COOPERATIVA AGROINDUSTRIAL DE PRODUTORES DE CORUMBATAI DO SUL E REGIAO) e instalação de Fonte geradora solar fotovoltaica. Com isto, será possível promover o uso racional e eficiente de energia.","Obteremos redução da demanda no horário de ponta (kW) e economia de energia (MWh/ano) em função da redução de consumo (kW/h). Isto possibilitará a COPEL atender novos consumidores sem investimentos adicionais, otimizando o uso do sistema elétrico, preservando o meio ambiente e contribuindo para a sustentabilidade.",2018-01-09,2023-03-20,"Iluminação: Mensuração da potencia ativa dos equipamentos de iluminação e estimativa do tempo de utilização dos ambientes tipicos, conforme permite a opção A do PIMVPGeração distribuída: Está previsto tempo de 12 meses para acompanhamento do projeto.",1.0010296428069667,"Copel Distribuição S.A., Rua Vicente Machado, Guarapuava, Região Geográfica Imediata de Guarapuava, Região Geográfica Intermediária de Guarapuava, Paraná, Região Sul, 85010-050, Brasil",-25.38696195,-51.474271,Paraná,Guarapuava
91,2024-04-01,COPEL DISTRIBUIÇÃO SA,8550,PE-02866-0178/2017,PEE CP 001/2016 Condominio Flex Accanto,Residencial,0.0,0.56,213.04,39.3,"O projeto teve como objetivo a eficientização energética no sistema de iluminação do Condominio Fléx Accanto. Com isto, poderemos promover o uso racional e eficiente de energia elétrica naquela unidade consumidora.","Obteremos redução da demanda no horário de ponta (kW) e economia de energia (MWh/ano) em função da redução de consumo (kW/h). Isto possibilitará a COPEL atender novos consumidores sem investimentos adicionais, otimizando o uso do sistema elétrico, preservando o meio ambiente e contribuindo para a sustentabilidade.",2017-09-11,2021-08-30,"A avaliação se dará pela opção A do protocolo, sendo que serão medidas a potência ativa de cada grupo de luminárias e conforme essa opção  o tempo de  utilização de cada ambiente tipico será estimado e o resultado será extrapolado para todo o universo de luminárias. Para a fonte incentivada será monitorado o consumo de energia, sendo o periodo de avaliação de 12 meses.",1.000943037337222,"Copel Distribuição S.A., Rua Vicente Machado, Guarapuava, Região Geográfica Imediata de Guarapuava, Região Geográfica Intermediária de Guarapuava, Paraná, Região Sul, 85010-050, Brasil",-25.38696195,-51.474271,Paraná,Guarapuava
92,2024-04-01,CELESC DISTRIBUIÇÃO SA,8683,PE-05697-0051/2018,Educação + Eficiente - Unoesc Joaçaba,Comércio e Serviços,0.0,0.63,204.02,38.52,O objetivo do presente diagnóstico energético é apresentar possibilidades de melhorar o aproveitamento energético do uso final iluminação e o aproveitamento da energia solar nas dependências da UNOESC,"Iluminação: será realizada a medição de parâmetros-chave, neste caso, a potência de energia elétrica, e estimadas as horas de utilização do sistema de iluminação com base nas medições de horímetro ou medidor de grandezas elétricas, para então, calcular o consumo de energia elétrica antes e após a implantação da ação de eficiência energética. Fotovoltaico: Medição da energia gerada pelo sistema fotovoltaico a partir do sistema de aquisição de dados presente no inversor do sistema fotovoltaico. Esta medição representa todos os dados para a determinação da energia gerada pelo sistema. Os dados relacionados a variável independente serão adquiridos a partir de estações solarimétrica próxima ao local que disponibilizam seus dados, ex.: estações do INMET  Instituto Nacional de Meteorologia.",2018-06-26,2022-08-22,"Opção A do PIMVP para Iluminação, Opção B do PIMVP o sistema fotovoltaico",1.0,"Celesc Distribuição S.A., 2987, Jardim América, Chapecó, Região Geográfica Imediata de Chapecó, Região Geográfica Intermediária de Chapecó, Santa Catarina, Região Sul, 89803-903, Brasil",-27.09851365,-52.64486742525156,Santa Catarina,Chapecó
94,2024-04-01,CEMIG DISTRIBUIÇÃO SA,11671,PE-04950-0112/2018,Cemig Hospitais,Comércio e Serviços,0.0,0.4,35306.44,9144.42,Reduzir o consumo e as perdas não técnicas de energia elétrica no setor hospitalar,"Serão realizadas medições individuais de potência elétrica de grupos homogêneos de equipamentos de iluminação predial. Nos focos cirúrgicos, será também medida a potência e estimado o tempo, através de utilização de horímetros e laudos de cirurgias, visando cálculo de Fator de Coincidência na Ponta. Serão realizadas medições individuais de potência elétrica e de tempo de utilização com a utilização de Medidores com memória de massa. O tempo em que serão realizadas as medições será entre uma semana (autoclaves, secadoras) e um mês (aquecimento solar e geração fotovoltaica).",2018-01-08,2023-09-20,"Opção A do PIMV, com amostragem estatística para os usos finais iluminação e foco cirúrgico. Opção B do PIMV, com medição total, para os usos finais autoclaves, secadoras, aquecimento de água e geração fotovoltaica",5.254091466923446,,,,MINAS GERAIS,BELO HORIZONTE
95,2024-04-01,CEMIG DISTRIBUIÇÃO SA,8298,PE-04950-0109/2017,Energia Cidadã RMBH,Baixa Renda,0.0,0.37,16012.24,4048.52,Reduzir o consumo e as perdas não técnicas de energia elétrica,Estaremos realizando medições individuais de um grupo do clientes que possuem a mesma característica de consumo,2017-09-15,2021-08-31,"Opção A do PIMVP, com amostragem estatística",2.9070736140077607,,,,MINAS GERAIS,BELO HORIZONTE
96,2024-04-01,CEMIG DISTRIBUIÇÃO SA,8610,PE-04950-0139/2018,Energia Cidadã Interior II,Baixa Renda,0.0,0.37,11590.07,2134.69,Reduzir o consumo e as perdas não técnicas de energia elétrica,Estaremos realizando medições individuais de um grupo do clientes que possuem a mesma característica de consumo,2018-06-18,2021-12-18,"Opção A do PIMVP, com amostragem estatística para iluminação e opção B do PIMVP para refrigeração e aquecimento solar.",2.2973711070039444,,,,MINAS GERAIS,BELO HORIZONTE
100,2024-04-01,COMPANHIA ENERGETICA DE ALAGOAS,12014,PE-00044-0020/2019,Bonus Eficiente 2019-2020,Residencial,0.0,0.24,4237.38,1643.59,"Incentivar a substituicao de lampadas, refrigeradores e condicionadores de ar antigos e ineficentes por aparelhos reconhecidamente eficientes, com selo Procel, por seus clientes residenciais, visando a reducao do consumo de energia e retirada de demanda na ponta do sistema.",nao se aplica,2019-12-13,2023-08-31,"Iluminacao: Opcao A,  Medicao do consumo e estimativa do tempo de uso e Refrigeracao: Opcao B, Medicao de todos os parametros, ambos de acordo com o Volume I do PIMVP, EVO 10000-1:2012 e Guia de Medicao e Verificacao para o Programa de Eficiencia Energetica Regulado pela Aneel.",1.5425765319705695,,,,ALAGOAS,MACEIÓ
